id_tramite,nombre_tramite,organo_rector,fecha_publicacion_produccion,marca_arancelado,link_de_acceso,validador_identidad
2645,Actualización Registro Empresas Servicios Portuarios,Ministerio de Economía,2019-04-09,NO ARANCELADO,https://tramitesadistancia.gob.ar/tramitesadistancia/detalle-tipo?id=2645,"Mi argentina,AFIP"
2646,BBVV - Alta y baja de bienes de Entidades de Bomberos Voluntarios,Ministerio de Seguridad Nacional,2019-04-09,NO ARANCELADO,https://tramitesadistancia.gob.ar/tramitesadistancia/detalle-tipo?id=2646,"Mi argentina,AFIP"
2647,Presentación de Datos Estadísticos - Cooperativas,Ministerio de Capital Humano,2019-04-11,NO ARANCELADO,https://tramitesadistancia.gob.ar/tramitesadistancia/detalle-tipo?id=2647,"Mi argentina,AFIP"
2648,Presentación de Datos Estadísticos - Mutuales,Ministerio de Capital Humano,2019-04-11,NO ARANCELADO,https://tramitesadistancia.gob.ar/tramitesadistancia/detalle-tipo?id=2648,"Mi argentina,AFIP"
2650,Licencias de Radioaficionados - HERTZ,Jefatura de Gabinete de Ministros,2019-04-16,NO ARANCELADO,https://tramitesadistancia.gob.ar/tramitesadistancia/detalle-tipo?id=2650,"Mi argentina,AFIP"
2651,Solicitud de certificado para la exención impositiva aduana,Ministerio de Seguridad Nacional,2019-04-16,NO ARANCELADO,https://tramitesadistancia.gob.ar/tramitesadistancia/detalle-tipo?id=2651,"Mi argentina,AFIP"
2652,Legalizaciones NECOCHEA BA1010,"Ministerio de Relaciones Exteriores, Comercio Internacional y Culto",2019-04-16,NO ARANCELADO,https://tramitesadistancia.gob.ar/tramitesadistancia/detalle-tipo?id=2652,"Mi argentina,AFIP"
2653,Legalizaciones NUEVE DE JULIO BA1011,"Ministerio de Relaciones Exteriores, Comercio Internacional y Culto",2019-04-16,NO ARANCELADO,https://tramitesadistancia.gob.ar/tramitesadistancia/detalle-tipo?id=2653,"Mi argentina,AFIP"
2654,Legalizaciones PERGAMINO BA1012,"Ministerio de Relaciones Exteriores, Comercio Internacional y Culto",2019-04-16,NO ARANCELADO,https://tramitesadistancia.gob.ar/tramitesadistancia/detalle-tipo?id=2654,"Mi argentina,AFIP"
2655,Legalizaciones AZUL BA1001,"Ministerio de Relaciones Exteriores, Comercio Internacional y Culto",2019-04-16,NO ARANCELADO,https://tramitesadistancia.gob.ar/tramitesadistancia/detalle-tipo?id=2655,"Mi argentina,AFIP"
2656,Legalizaciones SAN ISIDRO BA1013,"Ministerio de Relaciones Exteriores, Comercio Internacional y Culto",2019-04-16,NO ARANCELADO,https://tramitesadistancia.gob.ar/tramitesadistancia/detalle-tipo?id=2656,"Mi argentina,AFIP"
2657,Legalizaciones SAN MARTIN BA1014,"Ministerio de Relaciones Exteriores, Comercio Internacional y Culto",2019-04-16,NO ARANCELADO,https://tramitesadistancia.gob.ar/tramitesadistancia/detalle-tipo?id=2657,"Mi argentina,AFIP"
2658,Legalizaciones SAN NICOLAS BA1015,"Ministerio de Relaciones Exteriores, Comercio Internacional y Culto",2019-04-16,NO ARANCELADO,https://tramitesadistancia.gob.ar/tramitesadistancia/detalle-tipo?id=2658,"Mi argentina,AFIP"
2659,Legalizaciones BAHIA BLANCA BA1002,"Ministerio de Relaciones Exteriores, Comercio Internacional y Culto",2019-04-16,NO ARANCELADO,https://tramitesadistancia.gob.ar/tramitesadistancia/detalle-tipo?id=2659,"Mi argentina,AFIP"
2660,Legalizaciones TANDIL BA1016,"Ministerio de Relaciones Exteriores, Comercio Internacional y Culto",2019-04-16,NO ARANCELADO,https://tramitesadistancia.gob.ar/tramitesadistancia/detalle-tipo?id=2660,"Mi argentina,AFIP"
2661,Legalizaciones DOLORES BA1003,"Ministerio de Relaciones Exteriores, Comercio Internacional y Culto",2019-04-16,NO ARANCELADO,https://tramitesadistancia.gob.ar/tramitesadistancia/detalle-tipo?id=2661,"Mi argentina,AFIP"
2662,Legalizaciones TRENQUE LAUQUEN BA1017,"Ministerio de Relaciones Exteriores, Comercio Internacional y Culto",2019-04-16,NO ARANCELADO,https://tramitesadistancia.gob.ar/tramitesadistancia/detalle-tipo?id=2662,"Mi argentina,AFIP"
2663,Legalizaciones JUNIN BA1004,"Ministerio de Relaciones Exteriores, Comercio Internacional y Culto",2019-04-16,NO ARANCELADO,https://tramitesadistancia.gob.ar/tramitesadistancia/detalle-tipo?id=2663,"Mi argentina,AFIP"
2664,Legalizaciones QUILMES BA1018,"Ministerio de Relaciones Exteriores, Comercio Internacional y Culto",2019-04-16,NO ARANCELADO,https://tramitesadistancia.gob.ar/tramitesadistancia/detalle-tipo?id=2664,"Mi argentina,AFIP"
2665,Legalizaciones LA PLATA BA1005,"Ministerio de Relaciones Exteriores, Comercio Internacional y Culto",2019-04-16,NO ARANCELADO,https://tramitesadistancia.gob.ar/tramitesadistancia/detalle-tipo?id=2665,"Mi argentina,AFIP"
2666,Legalizaciones AVELLANEDA BA1019,"Ministerio de Relaciones Exteriores, Comercio Internacional y Culto",2019-04-16,NO ARANCELADO,https://tramitesadistancia.gob.ar/tramitesadistancia/detalle-tipo?id=2666,"Mi argentina,AFIP"
2667,Legalizaciones LOMAS DE ZAMORA BA1006,"Ministerio de Relaciones Exteriores, Comercio Internacional y Culto",2019-04-16,NO ARANCELADO,https://tramitesadistancia.gob.ar/tramitesadistancia/detalle-tipo?id=2667,"Mi argentina,AFIP"
2668,Legalizaciones TRES ARROYOS BA1020,"Ministerio de Relaciones Exteriores, Comercio Internacional y Culto",2019-04-16,NO ARANCELADO,https://tramitesadistancia.gob.ar/tramitesadistancia/detalle-tipo?id=2668,"Mi argentina,AFIP"
2669,Legalizaciones MAR DEL PLATA BA1007,"Ministerio de Relaciones Exteriores, Comercio Internacional y Culto",2019-04-16,NO ARANCELADO,https://tramitesadistancia.gob.ar/tramitesadistancia/detalle-tipo?id=2669,"Mi argentina,AFIP"
2670,Legalizaciones MERCEDES BA1008,"Ministerio de Relaciones Exteriores, Comercio Internacional y Culto",2019-04-16,NO ARANCELADO,https://tramitesadistancia.gob.ar/tramitesadistancia/detalle-tipo?id=2670,"Mi argentina,AFIP"
2671,Legalizaciones MORON BA1009,"Ministerio de Relaciones Exteriores, Comercio Internacional y Culto",2019-04-16,NO ARANCELADO,https://tramitesadistancia.gob.ar/tramitesadistancia/detalle-tipo?id=2671,"Mi argentina,AFIP"
2672,Recurso ante el Tribunal Fiscal de la Nación,Ministerio de Economía,2019-04-17,NO ARANCELADO,https://tramitesadistancia.gob.ar/tramitesadistancia/detalle-tipo?id=2672,"Mi argentina,AFIP"
2675,Liberación de vehículos,Ministerio de Economía,2019-04-23,NO ARANCELADO,https://tramitesadistancia.gob.ar/tramitesadistancia/detalle-tipo?id=2675,"DNI,Mi argentina,ANSES,AFIP"
2676,Inscripción Registro de Obsequios a Funcionarios Públicos,Ministerio de Justicia,2019-04-30,NO ARANCELADO,https://tramitesadistancia.gob.ar/tramitesadistancia/detalle-tipo?id=2676,"Mi argentina,AFIP"
2677,Aprobación de protocolos de calidad de productos de origen animal,Ministerio de Economía,2019-04-30,NO ARANCELADO,https://tramitesadistancia.gob.ar/tramitesadistancia/detalle-tipo?id=2677,"Mi argentina,AFIP"
2678,Inscripción al Registro de firmas de productos veterinarios - Droguerías,Ministerio de Economía,2019-05-02,NO ARANCELADO,https://tramitesadistancia.gob.ar/tramitesadistancia/detalle-tipo?id=2678,"Mi argentina,AFIP"
2679,Inscripción al Registro de firmas de productos veterinarios - Principios activos,Ministerio de Economía,2019-05-02,NO ARANCELADO,https://tramitesadistancia.gob.ar/tramitesadistancia/detalle-tipo?id=2679,"Mi argentina,AFIP"
2680,Inscripción al Registro de firmas de productos veterinarios - Firmas con planta,Ministerio de Economía,2019-05-02,NO ARANCELADO,https://tramitesadistancia.gob.ar/tramitesadistancia/detalle-tipo?id=2680,"Mi argentina,AFIP"
2682,Modificación al Registro de firmas de productos veterinarios - Cambio de Director Técnico,Ministerio de Economía,2019-05-02,NO ARANCELADO,https://tramitesadistancia.gob.ar/tramitesadistancia/detalle-tipo?id=2682,"Mi argentina,AFIP"
2683,Modificación al Registro de firmas de productos veterinarios - Alta de plantas,Ministerio de Economía,2019-05-02,NO ARANCELADO,https://tramitesadistancia.gob.ar/tramitesadistancia/detalle-tipo?id=2683,"Mi argentina,AFIP"
2684,Modificación al Registro de firmas de productos veterinarios - Transferencia de habilitación de establecimientos,Ministerio de Economía,2019-05-02,NO ARANCELADO,https://tramitesadistancia.gob.ar/tramitesadistancia/detalle-tipo?id=2684,"Mi argentina,AFIP"
2685,Modificación al Registro de firmas de productos veterinarios - Evaluación de anteproyecto de modificación de condiciones edilicias y/o construcción,Ministerio de Economía,2019-05-02,NO ARANCELADO,https://tramitesadistancia.gob.ar/tramitesadistancia/detalle-tipo?id=2685,"Mi argentina,AFIP"
2686,Modificación al Registro de firmas de productos veterinarios - Inspecciones y constataciones en establecimientos,Ministerio de Economía,2019-05-02,NO ARANCELADO,https://tramitesadistancia.gob.ar/tramitesadistancia/detalle-tipo?id=2686,"Mi argentina,AFIP"
2688,Rogatoria de informe de titularidad de dominio de aeronaves,Ministerio de Economía,2019-05-03,NO ARANCELADO,https://tramitesadistancia.gob.ar/tramitesadistancia/detalle-tipo?id=2688,"Mi argentina,AFIP"
2689,PFA - Pedido de informe varios para familiares directos,Ministerio de Seguridad Nacional,2019-05-03,NO ARANCELADO,https://tramitesadistancia.gob.ar/tramitesadistancia/detalle-tipo?id=2689,"DNI,Mi argentina,ANSES,AFIP"
2690,"Régimen de reparación económica para las niñas, niños y adolescentes - Ley 27.452",Ministerio de Capital Humano,2019-05-06,NO ARANCELADO,https://tramitesadistancia.gob.ar/tramitesadistancia/detalle-tipo?id=2690,"DNI,Mi argentina,ANSES,AFIP"
2691,Cuota ACE 59/72 Lácteos – Renuncia,Ministerio de Economía,2019-05-06,NO ARANCELADO,https://tramitesadistancia.gob.ar/tramitesadistancia/detalle-tipo?id=2691,"Mi argentina,AFIP"
2693,Desarchivo de trámites societarios,Ministerio de Justicia,2019-05-07,NO ARANCELADO,https://tramitesadistancia.gob.ar/tramitesadistancia/detalle-tipo?id=2693,"Mi argentina,AFIP"
2696,Inscripción en el Registro Nacional de Agentes del Seguro,Ministerio de Salud,2019-05-08,NO ARANCELADO,https://tramitesadistancia.gob.ar/tramitesadistancia/detalle-tipo?id=2696,"Mi argentina,AFIP"
2697,Presentación de comprobantes - Autogestión de proveedores,Ministerio de Salud,2019-05-08,NO ARANCELADO,https://tramitesadistancia.gob.ar/tramitesadistancia/detalle-tipo?id=2697,"Mi argentina,AFIP"
2698,Bienes de Capital - Informática y Telecomunicaciones,Ministerio de Economía,2019-05-08,NO ARANCELADO,https://tramitesadistancia.gob.ar/tramitesadistancia/detalle-tipo?id=2698,"Mi argentina,AFIP"
2699,Solicitud de Certificados de Libre Sanción,Ministerio de Salud,2019-05-09,NO ARANCELADO,https://tramitesadistancia.gob.ar/tramitesadistancia/detalle-tipo?id=2699,"Mi argentina,AFIP"
2700,Reconocimiento de Autoridades - Registro Nacional de Obras Sociales,Ministerio de Salud,2019-05-10,NO ARANCELADO,https://tramitesadistancia.gob.ar/tramitesadistancia/detalle-tipo?id=2700,"Mi argentina,AFIP"
2701,"Inspección para validar condiciones sanitarias para consumo interno o exportación de establecimientos de faena de animales terrestres, pesca y acuicultura, embarcaciones y flotantes",Ministerio de Economía,2019-05-10,NO ARANCELADO,https://tramitesadistancia.gob.ar/tramitesadistancia/detalle-tipo?id=2701,"Mi argentina,AFIP"
2702,Denuncias por infracción a la Ley de Semillas N° 20.247,Ministerio de Economía,2019-05-10,NO ARANCELADO,https://tramitesadistancia.gob.ar/tramitesadistancia/detalle-tipo?id=2702,"Mi argentina,AFIP"
2704,Solicitud de Licencia de Marca País,Secretaría General,2019-05-10,NO ARANCELADO,https://tramitesadistancia.gob.ar/tramitesadistancia/detalle-tipo?id=2704,"Mi argentina,AFIP"
2706,Alta de Delegaciones - Registro Nacional de Obras Sociales,Ministerio de Salud,2019-05-13,NO ARANCELADO,https://tramitesadistancia.gob.ar/tramitesadistancia/detalle-tipo?id=2706,"Mi argentina,AFIP"
2707,Inscripción de efectores médicos prestacionales - Establecimientos,Ministerio de Salud,2019-05-13,NO ARANCELADO,https://tramitesadistancia.gob.ar/tramitesadistancia/detalle-tipo?id=2707,"Mi argentina,AFIP"
2708,Inscripción de efectores médicos prestacionales - Profesionales,Ministerio de Salud,2019-05-13,NO ARANCELADO,https://tramitesadistancia.gob.ar/tramitesadistancia/detalle-tipo?id=2708,"Mi argentina,AFIP"
2709,Solicitud de Evaluación Cartilla Médica,Ministerio de Salud,2019-05-14,NO ARANCELADO,https://tramitesadistancia.gob.ar/tramitesadistancia/detalle-tipo?id=2709,"Mi argentina,AFIP"
2710,Solicitud de Evaluación Programa Médico Asistencial,Ministerio de Salud,2019-05-14,NO ARANCELADO,https://tramitesadistancia.gob.ar/tramitesadistancia/detalle-tipo?id=2710,"Mi argentina,AFIP"
2711,Contratos Entidades Prestacionales,Ministerio de Salud,2019-05-14,NO ARANCELADO,https://tramitesadistancia.gob.ar/tramitesadistancia/detalle-tipo?id=2711,"Mi argentina,AFIP"
2712,Análisis de Presupuesto de las Entidades Prestacionales,Ministerio de Salud,2019-05-14,NO ARANCELADO,https://tramitesadistancia.gob.ar/tramitesadistancia/detalle-tipo?id=2712,"Mi argentina,AFIP"
2713,Análisis y Evaluación de Obras Sociales en estado crítico,Ministerio de Salud,2019-05-14,NO ARANCELADO,https://tramitesadistancia.gob.ar/tramitesadistancia/detalle-tipo?id=2713,"Mi argentina,AFIP"
2714,Análisis de Estados Contables de Entidades Prestacionales,Ministerio de Salud,2019-05-14,NO ARANCELADO,https://tramitesadistancia.gob.ar/tramitesadistancia/detalle-tipo?id=2714,"Mi argentina,AFIP"
2715,Análisis de Estados de origen y aplicación de fondos de Entidades Prestacionales,Ministerio de Salud,2019-05-14,NO ARANCELADO,https://tramitesadistancia.gob.ar/tramitesadistancia/detalle-tipo?id=2715,"Mi argentina,AFIP"
2716,Solicitud de Ampliación de ámbito de actuación de Entidades,Ministerio de Salud,2019-05-14,NO ARANCELADO,https://tramitesadistancia.gob.ar/tramitesadistancia/detalle-tipo?id=2716,"Mi argentina,AFIP"
2717,Solicitud de Baja de Empresas de Medicina Prepaga,Ministerio de Salud,2019-05-14,NO ARANCELADO,https://tramitesadistancia.gob.ar/tramitesadistancia/detalle-tipo?id=2717,"Mi argentina,AFIP"
2719,Baja de Planes de Adherentes a Entidades Prestacionales,Ministerio de Salud,2019-05-14,NO ARANCELADO,https://tramitesadistancia.gob.ar/tramitesadistancia/detalle-tipo?id=2719,"Mi argentina,AFIP"
2720,Inscripción al Registro Nacional de Entidades de Medicina Prepaga,Ministerio de Salud,2019-05-14,NO ARANCELADO,https://tramitesadistancia.gob.ar/tramitesadistancia/detalle-tipo?id=2720,"Mi argentina,AFIP"
2721,Aprobación/Modificación de Estatutos de Agentes del Seguro,Ministerio de Salud,2019-05-14,NO ARANCELADO,https://tramitesadistancia.gob.ar/tramitesadistancia/detalle-tipo?id=2721,"Mi argentina,AFIP"
2722,Aumento de Cuota de Empresas de Medicina Prepaga,Ministerio de Salud,2019-05-14,NO ARANCELADO,https://tramitesadistancia.gob.ar/tramitesadistancia/detalle-tipo?id=2722,"Mi argentina,AFIP"
2723,Presentación de Reclamos de Beneficiarios,Ministerio de Salud,2019-05-14,NO ARANCELADO,https://tramitesadistancia.gob.ar/tramitesadistancia/detalle-tipo?id=2723,"Mi argentina,AFIP"
2724,Solicitud de Ampliación de ámbito del Personal de Entidades Prestacionales,Ministerio de Salud,2019-05-14,NO ARANCELADO,https://tramitesadistancia.gob.ar/tramitesadistancia/detalle-tipo?id=2724,"Mi argentina,AFIP"
2725,Alta Inmediata de Opciones,Ministerio de Salud,2019-05-14,NO ARANCELADO,https://tramitesadistancia.gob.ar/tramitesadistancia/detalle-tipo?id=2725,"Mi argentina,AFIP"
2726,Unificación de Aportes Jubilatorios,Ministerio de Salud,2019-05-14,NO ARANCELADO,https://tramitesadistancia.gob.ar/tramitesadistancia/detalle-tipo?id=2726,"Mi argentina,AFIP"
2727,Solicitud de Apoyo Financiero,Ministerio de Salud,2019-05-14,NO ARANCELADO,https://tramitesadistancia.gob.ar/tramitesadistancia/detalle-tipo?id=2727,"Mi argentina,AFIP"
2728,Registración de Autorizados,Ministerio de Salud,2019-05-14,NO ARANCELADO,https://tramitesadistancia.gob.ar/tramitesadistancia/detalle-tipo?id=2728,"Mi argentina,AFIP"
2729,Presentación de Planes de Salud Integrales. Entidades Prestacionales,Ministerio de Salud,2019-05-14,NO ARANCELADO,https://tramitesadistancia.gob.ar/tramitesadistancia/detalle-tipo?id=2729,"Mi argentina,AFIP"
2730,Alta al Programa de Medicamento Factor VIII para Hemofilia A Severa,Ministerio de Salud,2019-05-14,NO ARANCELADO,https://tramitesadistancia.gob.ar/tramitesadistancia/detalle-tipo?id=2730,"Mi argentina,AFIP"
2731,Declaraciones juradas TCFV/SU – HERTZ,Jefatura de Gabinete de Ministros,2019-05-14,NO ARANCELADO,https://tramitesadistancia.gob.ar/tramitesadistancia/detalle-tipo?id=2731,"Mi argentina,AFIP"
2732,"Solicitud de Alta, Baja o Modificación de Cuenta Bancaria",Ministerio de Salud,2019-05-14,NO ARANCELADO,https://tramitesadistancia.gob.ar/tramitesadistancia/detalle-tipo?id=2732,"Mi argentina,AFIP"
2736,Solicitud de Anulación de Opción de Cambio,Ministerio de Salud,2019-05-14,NO ARANCELADO,https://tramitesadistancia.gob.ar/tramitesadistancia/detalle-tipo?id=2736,"Mi argentina,AFIP"
2738,Solicitud de Alta de Ente en E-SIDIF,Ministerio de Salud,2019-05-14,NO ARANCELADO,https://tramitesadistancia.gob.ar/tramitesadistancia/detalle-tipo?id=2738,"Mi argentina,AFIP"
2740,"Autorización de Exhibición a Festivales, Ciclos y Muestras",Secretaría de Cultura,2019-05-17,NO ARANCELADO,https://tramitesadistancia.gob.ar/tramitesadistancia/detalle-tipo?id=2740,"Mi argentina,AFIP"
2741,Presentación de Documentación para poder expedir Certificado de Libre Deuda para Estudios/Laboratorios de Doblaje,Secretaría de Cultura,2019-05-17,NO ARANCELADO,https://tramitesadistancia.gob.ar/tramitesadistancia/detalle-tipo?id=2741,"Mi argentina,AFIP"
2742,Registro de Postulantes y Referentes PAE - Actualización de datos,Ministerio de Capital Humano,2019-05-20,NO ARANCELADO,https://tramitesadistancia.gob.ar/tramitesadistancia/detalle-tipo?id=2742,"DNI,Mi argentina,ANSES,AFIP"
2743,Solicitud de Alta de Entidad de Certificación de Origen Digital,Ministerio de Economía,2019-05-20,NO ARANCELADO,https://tramitesadistancia.gob.ar/tramitesadistancia/detalle-tipo?id=2743,"Mi argentina,AFIP"
2744,Solicitud de Certificado de Seguridad Vehicular Abreviado - Categoría 04,Ministerio de Economía,2019-05-21,NO ARANCELADO,https://tramitesadistancia.gob.ar/tramitesadistancia/detalle-tipo?id=2744,AFIP
2745,Oficio Judicial - ANSES,Ministerio de Capital Humano,2019-05-22,NO ARANCELADO,https://tramitesadistancia.gob.ar/tramitesadistancia/detalle-tipo?id=2745,"AFIP,ANSES,Mi argentina"
2746,Inscripción en el Registro Nacional de Fabricantes de Carrocerías y Talleres (RNFCyT),Ministerio de Economía,2019-05-22,NO ARANCELADO,https://tramitesadistancia.gob.ar/tramitesadistancia/detalle-tipo?id=2746,"Mi argentina,AFIP"
2747,Solicitud de auditoria para la verificación de buenas prácticas de manufacturas (BPM) o análisis de peligros y puntos críticos de control (APPCC/HACCP),Ministerio de Economía,2019-05-23,NO ARANCELADO,https://tramitesadistancia.gob.ar/tramitesadistancia/detalle-tipo?id=2747,"Mi argentina,AFIP"
2748,Sistema Informativo del Estado de la Cartera de Juicios y Mediaciones,Ministerio de Economía,2019-05-24,NO ARANCELADO,https://tramitesadistancia.gob.ar/tramitesadistancia/detalle-tipo?id=2748,"Mi argentina,AFIP"
2749,Autorización de Tercerización de Servicios,Ministerio de Salud,2019-05-24,NO ARANCELADO,https://tramitesadistancia.gob.ar/tramitesadistancia/detalle-tipo?id=2749,"Mi argentina,AFIP"
2750,Inscripción al Registro de empresas petroleras - Sección Productoras,Ministerio de Economía,2019-05-27,NO ARANCELADO,https://tramitesadistancia.gob.ar/tramitesadistancia/detalle-tipo?id=2750,AFIP
2751,Reinscripción/ Renovación al Registro de Empresas Petroleras - Sección Productoras,Ministerio de Economía,2019-05-27,NO ARANCELADO,https://tramitesadistancia.gob.ar/tramitesadistancia/detalle-tipo?id=2751,AFIP
2752,Solicitud de constancia de presentación de documentación ante el INAES para Cooperativas,Ministerio de Capital Humano,2019-05-27,NO ARANCELADO,https://tramitesadistancia.gob.ar/tramitesadistancia/detalle-tipo?id=2752,"Mi argentina,AFIP"
2753,Solicitud de constancia de domicilio legal declarado ante el INAES para Cooperativas,Ministerio de Capital Humano,2019-05-27,NO ARANCELADO,https://tramitesadistancia.gob.ar/tramitesadistancia/detalle-tipo?id=2753,"Mi argentina,AFIP"
2754,Inscripción al Registro de Instituciones de Bien Público Receptoras de Alimentos,Ministerio de Capital Humano,2019-05-29,NO ARANCELADO,https://tramitesadistancia.gob.ar/tramitesadistancia/detalle-tipo?id=2754,"Mi argentina,AFIP"
2755,Renovación del Registro de Instituciones de Bien Público Receptoras de Alimentos,Ministerio de Capital Humano,2019-05-29,NO ARANCELADO,https://tramitesadistancia.gob.ar/tramitesadistancia/detalle-tipo?id=2755,"Mi argentina,AFIP"
2756,Actualización del Registro de Instituciones de Bien Público Receptoras de Alimentos,Ministerio de Capital Humano,2019-05-29,NO ARANCELADO,https://tramitesadistancia.gob.ar/tramitesadistancia/detalle-tipo?id=2756,"Mi argentina,AFIP"
2757,Solicitud de constancia de domicilio legal declarado ante el INAES para Mutuales,Ministerio de Capital Humano,2019-05-29,NO ARANCELADO,https://tramitesadistancia.gob.ar/tramitesadistancia/detalle-tipo?id=2757,"Mi argentina,AFIP"
2758,Solicitud de constancia de presentación de documentación ante el INAES para Mutuales,Ministerio de Capital Humano,2019-05-29,NO ARANCELADO,https://tramitesadistancia.gob.ar/tramitesadistancia/detalle-tipo?id=2758,"Mi argentina,AFIP"
2759,Certificación de calidad e inocuidad para la exportación de granos a requerimiento de terceros mercados,Ministerio de Economía,2019-06-03,NO ARANCELADO,https://tramitesadistancia.gob.ar/tramitesadistancia/detalle-tipo?id=2759,"Mi argentina,AFIP"
2760,Presentaciones vinculadas a Reaseguro,Ministerio de Economía,2019-06-04,NO ARANCELADO,https://tramitesadistancia.gob.ar/tramitesadistancia/detalle-tipo?id=2760,"Mi argentina,AFIP"
2761,Solicitud de Tarifa Diferencial para Entidades Religiosas,"Ministerio de Relaciones Exteriores, Comercio Internacional y Culto",2019-06-04,NO ARANCELADO,https://tramitesadistancia.gob.ar/tramitesadistancia/detalle-tipo?id=2761,"DNI,Mi argentina,ANSES,AFIP"
2762,Solicitud de Tarifa Diferencial para Entidades de Bien Público,Ministerio de Capital Humano,2019-06-04,NO ARANCELADO,https://tramitesadistancia.gob.ar/tramitesadistancia/detalle-tipo?id=2762,"DNI,Mi argentina,ANSES,AFIP"
2763,Presentación de Facturas de Bienes y Servicios,Ministerio de Economía,2019-06-04,NO ARANCELADO,https://tramitesadistancia.gob.ar/tramitesadistancia/detalle-tipo?id=2763,AFIP
2764,Solicitud de notas de excepción para importación,Ministerio de Salud,2019-06-05,NO ARANCELADO,https://tramitesadistancia.gob.ar/tramitesadistancia/detalle-tipo?id=2764,"DNI,Mi argentina,ANSES,AFIP"
2770,Solicitud de Coordinación (CR/C) de una red o sistema de satélites ante la BR de la UIT,Jefatura de Gabinete de Ministros,2019-06-10,NO ARANCELADO,https://tramitesadistancia.gob.ar/tramitesadistancia/detalle-tipo?id=2770,"Mi argentina,AFIP"
2771,Solicitud de Notificación de una Estación de Radioastronomía ante la BR de la UIT,Jefatura de Gabinete de Ministros,2019-06-10,NO ARANCELADO,https://tramitesadistancia.gob.ar/tramitesadistancia/detalle-tipo?id=2771,"Mi argentina,AFIP"
2772,Solicitud de API de una red o sistema de satélites No Geo ante la BR de la UIT,Jefatura de Gabinete de Ministros,2019-06-10,NO ARANCELADO,https://tramitesadistancia.gob.ar/tramitesadistancia/detalle-tipo?id=2772,"Mi argentina,AFIP"
2773,Solicitud de Provisión de Servicios Mundiales de Comunicaciones por Satélite a través de constelaciones No Geo en el SFS y SMS,Jefatura de Gabinete de Ministros,2019-06-10,NO ARANCELADO,https://tramitesadistancia.gob.ar/tramitesadistancia/detalle-tipo?id=2773,"Mi argentina,AFIP"
2774,Solicitud de Autorización para actuar como Autoridad Contable en el SMMS,Jefatura de Gabinete de Ministros,2019-06-10,NO ARANCELADO,https://tramitesadistancia.gob.ar/tramitesadistancia/detalle-tipo?id=2774,"Mi argentina,AFIP"
2775,Solicitud de Registro de los Contratos suscriptos por los Proveedores de Facilidades Satelitales autorizados en el SFS y SRS,Jefatura de Gabinete de Ministros,2019-06-10,NO ARANCELADO,https://tramitesadistancia.gob.ar/tramitesadistancia/detalle-tipo?id=2775,"Mi argentina,AFIP"
2776,Solicitud de Autorización para la Provisión del SMS a través de sistemas geoestacionarios,Jefatura de Gabinete de Ministros,2019-06-10,NO ARANCELADO,https://tramitesadistancia.gob.ar/tramitesadistancia/detalle-tipo?id=2776,"Mi argentina,AFIP"
2777,Excepción Calendario Tentativo de Estreno de Películas,Secretaría de Cultura,2019-06-10,NO ARANCELADO,https://tramitesadistancia.gob.ar/tramitesadistancia/detalle-tipo?id=2777,"Mi argentina,AFIP"
2778,Presentación de nómina de contenidos audiovisuales para su exhibición en televisión,Secretaría de Cultura,2019-06-11,NO ARANCELADO,https://tramitesadistancia.gob.ar/tramitesadistancia/detalle-tipo?id=2778,"Mi argentina,AFIP"
2779,Solicitud para la Inscripción en el Registro de Organismos de Certificación (ROC) de ENARGAS,Ministerio de Economía,2019-06-12,NO ARANCELADO,https://tramitesadistancia.gob.ar/tramitesadistancia/detalle-tipo?id=2779,"Mi argentina,AFIP"
2780,Solicitud para la Actualización y/o Modificación de datos en el Registro de Organismos de Certificación (ROC) de ENARGAS,Ministerio de Economía,2019-06-13,NO ARANCELADO,https://tramitesadistancia.gob.ar/tramitesadistancia/detalle-tipo?id=2780,"Mi argentina,AFIP"
2781,Solicitud para la Baja del Registro de Organismos de Certificación (ROC) de ENARGAS,Ministerio de Economía,2019-06-13,NO ARANCELADO,https://tramitesadistancia.gob.ar/tramitesadistancia/detalle-tipo?id=2781,"Mi argentina,AFIP"
2782,Declaración Jurada de Salas,Secretaría de Cultura,2019-06-14,NO ARANCELADO,https://tramitesadistancia.gob.ar/tramitesadistancia/detalle-tipo?id=2782,"Mi argentina,AFIP"
