id_tramite,nombre_tramite,organo_rector,fecha_publicacion_produccion,marca_arancelado,link_de_acceso,validador_identidad
5377,Declaración Jurada de composición de producto,Ministerio de Economía,2020-12-29,NO ARANCELADO,https://tramitesadistancia.gob.ar/tramitesadistancia/detalle-tipo?id=5377,"Mi argentina,AFIP"
5378,Asignación de CUIT para Cooperativas y Mutuales. Complemento de Inscripción,Ministerio de Capital Humano,2020-12-29,NO ARANCELADO,https://tramitesadistancia.gob.ar/tramitesadistancia/detalle-tipo?id=5378,"Mi argentina,AFIP"
5379,"Presentación de proyectos en el marco del ""Programa de despliegue de redes de acceso a servicios de comunicaciones móviles"" - Resolución 1477/2020",Jefatura de Gabinete de Ministros,2021-01-05,NO ARANCELADO,https://tramitesadistancia.gob.ar/tramitesadistancia/detalle-tipo?id=5379,"Mi argentina,AFIP"
5380,Presentación de documentación universitaria para solicitar Apostilla,Ministerio de Capital Humano,2021-01-06,NO ARANCELADO,https://tramitesadistancia.gob.ar/tramitesadistancia/detalle-tipo?id=5380,"Mi argentina,AFIP"
5382,Denuncia por Trabajo No Registrado,Ministerio de Capital Humano,2021-01-13,NO ARANCELADO,https://tramitesadistancia.gob.ar/tramitesadistancia/detalle-tipo?id=5382,"Mi argentina,AFIP"
5383,Presentación de proyectos en el marco del proyecto Delta Conectado - Resolución ENACOM 1489/2020,Jefatura de Gabinete de Ministros,2021-01-14,NO ARANCELADO,https://tramitesadistancia.gob.ar/tramitesadistancia/detalle-tipo?id=5383,"Mi argentina,AFIP"
5385,"Concurso de Proyectos para la Promoción, Protección y Difusión de Derechos de las y los Consumidores Hipervulnerables",Ministerio de Economía,2021-01-18,NO ARANCELADO,https://tramitesadistancia.gob.ar/tramitesadistancia/detalle-tipo?id=5385,"Mi argentina,AFIP"
5386,"Información Periódica - Art. 18 del Reglamento ""Fondo Fiduciario de Enfermedades Profesionales""",Ministerio de Economía,2021-01-18,NO ARANCELADO,https://tramitesadistancia.gob.ar/tramitesadistancia/detalle-tipo?id=5386,"Mi argentina,AFIP"
5387,Exposición administrativa en jurisdicción de la Prefectura Naval Argentina,Ministerio de Seguridad Nacional,2021-01-19,NO ARANCELADO,https://tramitesadistancia.gob.ar/tramitesadistancia/detalle-tipo?id=5387,"Mi argentina,AFIP"
5388,Sistema Electrónico de Precios Argentino (SEPA),Ministerio de Economía,2021-01-19,NO ARANCELADO,https://tramitesadistancia.gob.ar/tramitesadistancia/detalle-tipo?id=5388,"Mi argentina,AFIP"
5389,Informe de capacidad productiva y cadena de comercialización de productos anestésicos críticos,Ministerio de Salud,2021-01-20,NO ARANCELADO,https://tramitesadistancia.gob.ar/tramitesadistancia/detalle-tipo?id=5389,"Mi argentina,AFIP"
5390,Solicitud de Elegibilidad de Proyecto Estratégico,Ministerio de Economía,2021-01-21,NO ARANCELADO,https://tramitesadistancia.gob.ar/tramitesadistancia/detalle-tipo?id=5390,"Mi argentina,AFIP"
5391,Presentaciones de interferencias a servicios esenciales,Jefatura de Gabinete de Ministros,2021-01-25,NO ARANCELADO,https://tramitesadistancia.gob.ar/tramitesadistancia/detalle-tipo?id=5391,"Mi argentina,AFIP"
5392,Solicitud de autorización para la constitución de Redes de Emisoras de Radio y Televisión Abierta,Jefatura de Gabinete de Ministros,2021-01-26,NO ARANCELADO,https://tramitesadistancia.gob.ar/tramitesadistancia/detalle-tipo?id=5392,"Mi argentina,AFIP"
5393,Declaración de Conflictos de Interés potencial (DCI),Ministerio de Salud,2021-01-28,NO ARANCELADO,https://tramitesadistancia.gob.ar/tramitesadistancia/detalle-tipo?id=5393,"AFIP,ANSES,Mi argentina"
5394,Visado de Planos de Mensura,Jefatura de Gabinete de Ministros,2021-01-29,NO ARANCELADO,https://tramitesadistancia.gob.ar/tramitesadistancia/detalle-tipo?id=5394,"Mi argentina,AFIP"
5395,"Solicitud de Recomposición - Reglamento ""Fondo Fiduciario de Enfermedades Profesionales""",Ministerio de Economía,2021-02-01,NO ARANCELADO,https://tramitesadistancia.gob.ar/tramitesadistancia/detalle-tipo?id=5395,"Mi argentina,AFIP"
5398,Rendición de cuentas del Programa Nacional de Producción de Suelo,Ministerio de Economía,2021-02-09,NO ARANCELADO,https://tramitesadistancia.gob.ar/tramitesadistancia/detalle-tipo?id=5398,"Mi argentina,AFIP"
5399,Notificación de sucesos de transporte,Ministerio de Economía,2021-02-12,NO ARANCELADO,https://tramitesadistancia.gob.ar/tramitesadistancia/detalle-tipo?id=5399,"Mi argentina,AFIP"
5400,Certificación de Cursos Docentes,Ministerio de Capital Humano,2021-02-18,NO ARANCELADO,https://tramitesadistancia.gob.ar/tramitesadistancia/detalle-tipo?id=5400,"Mi argentina,AFIP"
5401,Franquicia Automotor para Instituciones y/u Organismos Gubernamentales,Ministerio de Salud,2021-02-18,NO ARANCELADO,https://tramitesadistancia.gob.ar/tramitesadistancia/detalle-tipo?id=5401,"Mi argentina,AFIP"
5402,Solicitudes de asistencia en materia de Seguridad Federal,Ministerio de Seguridad Nacional,2021-02-19,NO ARANCELADO,https://tramitesadistancia.gob.ar/tramitesadistancia/detalle-tipo?id=5402,"Mi argentina,AFIP"
5403,Tasa para Auditorías de Beneficiarios del Régimen de Promoción de Biotecnología Moderna,Ministerio de Economía,2021-03-01,ARANCELADO,https://tramitesadistancia.gob.ar/tramitesadistancia/detalle-tipo?id=5403,"Mi argentina,AFIP"
5404,Solicitud de Acreditación de Empresas para Tratamiento de PGRA y PGRJ,Ministerio de Economía,2021-03-02,NO ARANCELADO,https://tramitesadistancia.gob.ar/tramitesadistancia/detalle-tipo?id=5404,"Mi argentina,AFIP"
5405,Inscripción al concurso CREAR N6 FEDERAL,Secretaría de Comunicación y Medios,2021-03-08,NO ARANCELADO,https://tramitesadistancia.gob.ar/tramitesadistancia/detalle-tipo?id=5405,"Mi argentina,AFIP"
5406,Oficios Judiciales CONICET,Jefatura de Gabinete de Ministros,2021-03-08,NO ARANCELADO,https://tramitesadistancia.gob.ar/tramitesadistancia/detalle-tipo?id=5406,"Mi argentina,AFIP"
5408,Nube Híbrida en Gobierno/ARSAT,Jefatura de Gabinete de Ministros,2021-03-11,NO ARANCELADO,https://tramitesadistancia.gob.ar/tramitesadistancia/detalle-tipo?id=5408,"DNI,Mi argentina,ANSES,AFIP"
5409,Nuevos predios - PROCREAR,Ministerio de Economía,2021-03-12,NO ARANCELADO,https://tramitesadistancia.gob.ar/tramitesadistancia/detalle-tipo?id=5409,"Mi argentina,AFIP"
5410,Certificado de ingrediente farmacéutico activo,Ministerio de Salud,2021-03-18,NO ARANCELADO,https://tramitesadistancia.gob.ar/tramitesadistancia/detalle-tipo?id=5410,"Mi argentina,AFIP"
5411,Solicitud de prórroga de licencia de servicios de comunicación audiovisual,Jefatura de Gabinete de Ministros,2021-03-18,NO ARANCELADO,https://tramitesadistancia.gob.ar/tramitesadistancia/detalle-tipo?id=5411,"Mi argentina,AFIP"
5412,Proyectos PNUD - Presentación Contrato (Bienes y Servicios) / Orden de Compra,"Ministerio de Relaciones Exteriores, Comercio Internacional y Culto",2021-03-18,NO ARANCELADO,https://tramitesadistancia.gob.ar/tramitesadistancia/detalle-tipo?id=5412,"Mi argentina,AFIP"
5413,Oposiciones a aportes no reembolsables,Jefatura de Gabinete de Ministros,2021-03-18,NO ARANCELADO,https://tramitesadistancia.gob.ar/tramitesadistancia/detalle-tipo?id=5413,"Mi argentina,AFIP"
5414,Presentación de Propuestas para el suministro de servicios de consultoría ante la Dirección Nacional de Preinversión,Ministerio de Economía,2021-03-23,NO ARANCELADO,https://tramitesadistancia.gob.ar/tramitesadistancia/detalle-tipo?id=5414,"Mi argentina,AFIP"
5418,Certificado de Libre Disponibilidad por Tiempo Transcurrido para Instituciones y Organismos Gubernamentales,Ministerio de Salud,2021-04-09,NO ARANCELADO,https://tramitesadistancia.gob.ar/tramitesadistancia/detalle-tipo?id=5418,"Mi argentina,AFIP"
5419,Certificado de Libre Disponibilidad por Robo o Siniestro para Instituciones y Organismos Gubernamentales,Ministerio de Salud,2021-04-09,NO ARANCELADO,https://tramitesadistancia.gob.ar/tramitesadistancia/detalle-tipo?id=5419,"Mi argentina,AFIP"
5420,Alta - Inventario Nacional de Bienes y Servicios TIC,Jefatura de Gabinete de Ministros,2021-04-09,NO ARANCELADO,https://tramitesadistancia.gob.ar/tramitesadistancia/detalle-tipo?id=5420,"Mi argentina,AFIP"
5422,Solicitud de Financiamiento – Programa Nacional CASA PROPIA – Construir Futuro,Ministerio de Economía,2021-04-15,NO ARANCELADO,https://tramitesadistancia.gob.ar/tramitesadistancia/detalle-tipo?id=5422,"Mi argentina,AFIP"
5423,Solicitud de Inscripción al Registro de Proveedores Sociales y MiPyMES de ACUMAR,Ministerio de Economía,2021-04-15,NO ARANCELADO,https://tramitesadistancia.gob.ar/tramitesadistancia/detalle-tipo?id=5423,"Mi argentina,AFIP"
5425,Inscripción a Concurso para Guionistas,Secretaría de Comunicación y Medios,2021-04-21,NO ARANCELADO,https://tramitesadistancia.gob.ar/tramitesadistancia/detalle-tipo?id=5425,"Mi argentina,AFIP"
5426,Sociedades de Capitalización y Ahorro – Lista de precios,Ministerio de Justicia,2021-04-26,NO ARANCELADO,https://tramitesadistancia.gob.ar/tramitesadistancia/detalle-tipo?id=5426,"Mi argentina,AFIP"
5427,Sociedades de Capitalización y Ahorro – Tasa de Inspección,Ministerio de Justicia,2021-04-26,NO ARANCELADO,https://tramitesadistancia.gob.ar/tramitesadistancia/detalle-tipo?id=5427,"Mi argentina,AFIP"
5429,Solicitud de Autorización para Celebrar Asamblea Fuera de Jurisdicción,Ministerio de Justicia,2021-04-30,NO ARANCELADO,https://tramitesadistancia.gob.ar/tramitesadistancia/detalle-tipo?id=5429,"Mi argentina,AFIP"
5431,Declaración Jurada de Confidencialidad por Intercambio Datos Sensibles,Ministerio de Capital Humano,2021-05-03,NO ARANCELADO,https://tramitesadistancia.gob.ar/tramitesadistancia/detalle-tipo?id=5431,"Mi argentina,AFIP"
5434,PAC Emprendedores Llamados Específicos - Emprendedores de Impacto,Ministerio de Economía,2021-05-13,NO ARANCELADO,https://tramitesadistancia.gob.ar/tramitesadistancia/detalle-tipo?id=5434,"Mi argentina,AFIP"
5435,PAC Emprendedores Llamados Específicos - Emprendedores para la Innovación,Ministerio de Economía,2021-05-13,NO ARANCELADO,https://tramitesadistancia.gob.ar/tramitesadistancia/detalle-tipo?id=5435,"Mi argentina,AFIP"
5436,Presentación de Proyectos en el Marco del Programa de Subsidio de Tasas de Créditos para Capital de Trabajo para Licenciatarios de Servicios TIC - Bco. Nación - Resolución ENACOM 152/2021,Jefatura de Gabinete de Ministros,2021-05-19,NO ARANCELADO,https://tramitesadistancia.gob.ar/tramitesadistancia/detalle-tipo?id=5436,"Mi argentina,AFIP"
5437,Presentación Concurso ANR Para Pequeños Licenciatarios - Resolución ENACOM 1490/2020,Jefatura de Gabinete de Ministros,2021-05-19,NO ARANCELADO,https://tramitesadistancia.gob.ar/tramitesadistancia/detalle-tipo?id=5437,"Mi argentina,AFIP"
5438,Declaración Jurada Anual de Grilla de Señales,Jefatura de Gabinete de Ministros,2021-05-19,NO ARANCELADO,https://tramitesadistancia.gob.ar/tramitesadistancia/detalle-tipo?id=5438,"Mi argentina,AFIP"
5439,Solicitud de crédito para MiPyMEs forestoindustriales - FONDAGRO,Ministerio de Economía,2021-05-20,NO ARANCELADO,https://tramitesadistancia.gob.ar/tramitesadistancia/detalle-tipo?id=5439,"Mi argentina,AFIP"
5441,Rendición de Fianza REGINAVE,Ministerio de Seguridad Nacional,2021-06-08,NO ARANCELADO,https://tramitesadistancia.gob.ar/tramitesadistancia/detalle-tipo?id=5441,"Mi argentina,AFIP"
5442,Pago de Tasa en concepto de Verificación y Control (Economía del Conocimiento),Ministerio de Economía,2021-06-11,ARANCELADO,https://tramitesadistancia.gob.ar/tramitesadistancia/detalle-tipo?id=5442,"Mi argentina,AFIP"
5444,Programa de Apoyo a la Competitividad -PAC- Asistencia Técnica a MiPyme,Ministerio de Economía,2021-06-18,NO ARANCELADO,https://tramitesadistancia.gob.ar/tramitesadistancia/detalle-tipo?id=5444,"Mi argentina,AFIP"
5445,Solicitud Asignación de la Reserva de Administración,Ministerio de Economía,2021-06-25,NO ARANCELADO,https://tramitesadistancia.gob.ar/tramitesadistancia/detalle-tipo?id=5445,"Mi argentina,AFIP"
5446,Puesta a Disposición de la Reserva de Administración,Ministerio de Economía,2021-06-25,NO ARANCELADO,https://tramitesadistancia.gob.ar/tramitesadistancia/detalle-tipo?id=5446,"Mi argentina,AFIP"
5447,Procesos de adquisición de bienes y contratación de consultores - Programa PROCER Universidades,Ministerio de Economía,2021-06-28,NO ARANCELADO,https://tramitesadistancia.gob.ar/tramitesadistancia/detalle-tipo?id=5447,"Mi argentina,AFIP"
5448,SIRECO - Requerimiento de excepción al período de empadronamiento de cuentas bancarias,Ministerio de Economía,2021-06-28,NO ARANCELADO,https://tramitesadistancia.gob.ar/tramitesadistancia/detalle-tipo?id=5448,AFIP
5449,Ingreso de documentación para facturación de compra de Factor VIII,Ministerio de Salud,2021-06-29,NO ARANCELADO,https://tramitesadistancia.gob.ar/tramitesadistancia/detalle-tipo?id=5449,"Mi argentina,AFIP"
5450,Solicitud de Reconocimiento de Coproducción Internacional,Secretaría de Cultura,2021-06-30,NO ARANCELADO,https://tramitesadistancia.gob.ar/tramitesadistancia/detalle-tipo?id=5450,"Mi argentina,AFIP"
5454,FONARSEC | Agencia I+D+i,Jefatura de Gabinete de Ministros,2021-07-01,NO ARANCELADO,https://tramitesadistancia.gob.ar/tramitesadistancia/detalle-tipo?id=5454,"Mi argentina,AFIP"
5455,Inscripción de Proveedores - Ley de Góndolas,Ministerio de Economía,2021-07-06,NO ARANCELADO,https://tramitesadistancia.gob.ar/tramitesadistancia/detalle-tipo?id=5455,"Mi argentina,AFIP"
5456,Programa Federal de Fortalecimiento de la Reactivación Productiva - solicitud de adhesión MiPyMEs,Ministerio de Economía,2021-07-08,NO ARANCELADO,https://tramitesadistancia.gob.ar/tramitesadistancia/detalle-tipo?id=5456,"Mi argentina,AFIP"
5459,Constitución de Cooperativas de Trabajo con Formulario Proforma,Ministerio de Capital Humano,2021-07-15,NO ARANCELADO,https://tramitesadistancia.gob.ar/tramitesadistancia/detalle-tipo?id=5459,"Mi argentina,AFIP"
5460,Programa Federal de Fortalecimiento de la Reactivación Productiva - Solicitud de Adhesión Empresas (NO PYMES),Ministerio de Economía,2021-07-15,NO ARANCELADO,https://tramitesadistancia.gob.ar/tramitesadistancia/detalle-tipo?id=5460,"Mi argentina,AFIP"
5461,Solicitud de actualización del Registro de Proveedores Sociales y MiPyMES de ACUMAR,Ministerio de Economía,2021-07-16,NO ARANCELADO,https://tramitesadistancia.gob.ar/tramitesadistancia/detalle-tipo?id=5461,"Mi argentina,AFIP"
5462,Solicitud certificado de vigencia de licencia o autorización de servicios de comunicación audiovisual,Jefatura de Gabinete de Ministros,2021-07-22,NO ARANCELADO,https://tramitesadistancia.gob.ar/tramitesadistancia/detalle-tipo?id=5462,"Mi argentina,AFIP"
5463,Procesos de adquisición de bienes y contratación de consultores – Programa PROCER Fortalecimiento Institucional,Ministerio de Economía,2021-07-23,NO ARANCELADO,https://tramitesadistancia.gob.ar/tramitesadistancia/detalle-tipo?id=5463,"Mi argentina,AFIP"
5464,Solicitud de renuncia de la licencia o autorización para la prestación de servicios de comunicación audiovisual,Jefatura de Gabinete de Ministros,2021-07-23,NO ARANCELADO,https://tramitesadistancia.gob.ar/tramitesadistancia/detalle-tipo?id=5464,"Mi argentina,AFIP"
5465,Rendición de Aportes No Reembolsables – BARRIOS POPULARES,Jefatura de Gabinete de Ministros,2021-07-27,NO ARANCELADO,https://tramitesadistancia.gob.ar/tramitesadistancia/detalle-tipo?id=5465,"Mi argentina,AFIP"
5466,Solicitud de Inscripción al Programa Nodos de la Economía del Conocimiento,Ministerio de Economía,2021-07-28,NO ARANCELADO,https://tramitesadistancia.gob.ar/tramitesadistancia/detalle-tipo?id=5466,AFIP
5467,SIRECO - e-SIDIF – Incorporación de bancos y sucursales,Ministerio de Economía,2021-07-30,NO ARANCELADO,https://tramitesadistancia.gob.ar/tramitesadistancia/detalle-tipo?id=5467,AFIP
5468,"Presentación de Proyectos ANR para ""Redes Comunitarias - Programa Roberto Arias"" - Resolución ENACOM 799/2021",Jefatura de Gabinete de Ministros,2021-08-03,NO ARANCELADO,https://tramitesadistancia.gob.ar/tramitesadistancia/detalle-tipo?id=5468,"Mi argentina,AFIP"
5472,Actas Consejo Asesor - RPE,Ministerio de Economía,2021-08-09,NO ARANCELADO,https://tramitesadistancia.gob.ar/tramitesadistancia/detalle-tipo?id=5472,"Mi argentina,AFIP"
5474,Presentaciones de Sujetos Alcanzados por la Ley de Góndolas,Ministerio de Economía,2021-08-11,NO ARANCELADO,https://tramitesadistancia.gob.ar/tramitesadistancia/detalle-tipo?id=5474,"Mi argentina,AFIP"
5475,Solicitud de Financiamiento – Programa Nacional RECONSTRUIR,Ministerio de Economía,2021-08-11,NO ARANCELADO,https://tramitesadistancia.gob.ar/tramitesadistancia/detalle-tipo?id=5475,"Mi argentina,AFIP"
5476,LÍNEA DE ANR PARA EL FORTALECIMIENTO DE LAS CAPACIDADES INSTITUCIONALES PARA EL APOYO A MiPyMEs,Ministerio de Economía,2021-08-23,NO ARANCELADO,https://tramitesadistancia.gob.ar/tramitesadistancia/detalle-tipo?id=5476,"Mi argentina,AFIP"
5477,Actualización de Información de Licencia de Configuración Ambiental (LCA) - Vehículos pesados,Jefatura de Gabinete de Ministros,2021-08-25,NO ARANCELADO,https://tramitesadistancia.gob.ar/tramitesadistancia/detalle-tipo?id=5477,"Mi argentina,AFIP"
5478,Extensión de Licencia de Configuración Ambiental (LCA) – Vehículos Pesados,Jefatura de Gabinete de Ministros,2021-08-25,NO ARANCELADO,https://tramitesadistancia.gob.ar/tramitesadistancia/detalle-tipo?id=5478,"Mi argentina,AFIP"
5479,Obtención de Licencia de Configuración Ambiental (LCA) - Vehículos Pesados,Jefatura de Gabinete de Ministros,2021-08-25,NO ARANCELADO,https://tramitesadistancia.gob.ar/tramitesadistancia/detalle-tipo?id=5479,"Mi argentina,AFIP"
5480,Actualización de Información de la Licencia de Configuración Ambiental (LCA) - vehículos Livianos,Jefatura de Gabinete de Ministros,2021-08-25,NO ARANCELADO,https://tramitesadistancia.gob.ar/tramitesadistancia/detalle-tipo?id=5480,"Mi argentina,AFIP"
5481,Extensión de Licencia de Configuración Ambiental (LCA) - Vehículos Livianos,Jefatura de Gabinete de Ministros,2021-08-25,NO ARANCELADO,https://tramitesadistancia.gob.ar/tramitesadistancia/detalle-tipo?id=5481,"Mi argentina,AFIP"
5482,Obtención de Licencia de Configuración Ambiental (LCA) - Vehículos Livianos,Jefatura de Gabinete de Ministros,2021-08-25,NO ARANCELADO,https://tramitesadistancia.gob.ar/tramitesadistancia/detalle-tipo?id=5482,"Mi argentina,AFIP"
5483,Extensión de Licencia de Configuración Ambiental (LCA) – Motores Pesados,Jefatura de Gabinete de Ministros,2021-08-25,NO ARANCELADO,https://tramitesadistancia.gob.ar/tramitesadistancia/detalle-tipo?id=5483,"Mi argentina,AFIP"
5484,Actualización de Información de la Licencia de Configuración Ambiental (LCA) - Motores Pesados,Jefatura de Gabinete de Ministros,2021-08-25,NO ARANCELADO,https://tramitesadistancia.gob.ar/tramitesadistancia/detalle-tipo?id=5484,"Mi argentina,AFIP"
5485,Obtención de Licencia de Configuración Ambiental (LCA) - Motores Pesados,Jefatura de Gabinete de Ministros,2021-08-25,NO ARANCELADO,https://tramitesadistancia.gob.ar/tramitesadistancia/detalle-tipo?id=5485,"Mi argentina,AFIP"
5486,Convocatoria Programa PROCER - Centros Tecnológicos,Ministerio de Economía,2021-08-25,NO ARANCELADO,https://tramitesadistancia.gob.ar/tramitesadistancia/detalle-tipo?id=5486,"Mi argentina,AFIP"
5489,Solicitud de Inscripción en el Registro Nacional de Entidades Certificadoras de Pilas y Baterías,Jefatura de Gabinete de Ministros,2021-09-01,NO ARANCELADO,https://tramitesadistancia.gob.ar/tramitesadistancia/detalle-tipo?id=5489,"Mi argentina,AFIP"
5490,Plan Nacional de Huellas Mineras,Ministerio de Economía,2021-09-03,NO ARANCELADO,https://tramitesadistancia.gob.ar/tramitesadistancia/detalle-tipo?id=5490,"Mi argentina,AFIP"
5491,Modificación de Datos en el Registro Nacional de Entidades Certificadoras de Pilas y Baterías,Jefatura de Gabinete de Ministros,2021-09-08,NO ARANCELADO,https://tramitesadistancia.gob.ar/tramitesadistancia/detalle-tipo?id=5491,"Mi argentina,AFIP"
5492,Renovación Anual del Registro Nacional de Entidades Certificadoras de Pilas y Baterías,Jefatura de Gabinete de Ministros,2021-09-08,NO ARANCELADO,https://tramitesadistancia.gob.ar/tramitesadistancia/detalle-tipo?id=5492,"Mi argentina,AFIP"
5493,Propuestas ciudadanas - Elaboración participativa de normas,Ministerio de Justicia,2021-09-09,NO ARANCELADO,https://tramitesadistancia.gob.ar/tramitesadistancia/detalle-tipo?id=5493,"DNI,Mi argentina,ANSES,AFIP"
5495,Asistencia a Prestadores de Servicios TIC ante emergencias y catástrofes - Resolución ENACOM 449/2021,Jefatura de Gabinete de Ministros,2021-09-09,NO ARANCELADO,https://tramitesadistancia.gob.ar/tramitesadistancia/detalle-tipo?id=5495,"Mi argentina,AFIP"
5496,Convocatoria para la adjudicación de ANR destinados al despliegue infraestructura de conectividad - acceso a internet - a parques industriales públicos y mixtos - Resolución ENACOM 100/2021,Jefatura de Gabinete de Ministros,2021-09-09,NO ARANCELADO,https://tramitesadistancia.gob.ar/tramitesadistancia/detalle-tipo?id=5496,"Mi argentina,AFIP"
5497,Programa de Impulso al Desarrollo de las Economías Regionales (IDER),Ministerio de Economía,2021-09-14,NO ARANCELADO,https://tramitesadistancia.gob.ar/tramitesadistancia/detalle-tipo?id=5497,"Mi argentina,AFIP"
5498,Autorización de importación de productos químicos comprendidos en el Convenio de Rotterdam,Jefatura de Gabinete de Ministros,2021-09-15,NO ARANCELADO,https://tramitesadistancia.gob.ar/tramitesadistancia/detalle-tipo?id=5498,"Mi argentina,AFIP"
5499,Autorización de exportación de productos químicos comprendidos en el Convenio de Rotterdam,Jefatura de Gabinete de Ministros,2021-09-15,NO ARANCELADO,https://tramitesadistancia.gob.ar/tramitesadistancia/detalle-tipo?id=5499,"Mi argentina,AFIP"
5500,"Inscripción a la Convocatoria ""POTENCIAR INDUSTRIA SATELITAL Y AEROESPACIAL",Ministerio de Economía,2021-09-16,NO ARANCELADO,https://tramitesadistancia.gob.ar/tramitesadistancia/detalle-tipo?id=5500,"Mi argentina,AFIP"
5501,Reestructuración de Gastos - Convocatoria “POTENCIAR INDUSTRIA SATELITAL Y AEROESPACIAL,Ministerio de Economía,2021-09-17,NO ARANCELADO,https://tramitesadistancia.gob.ar/tramitesadistancia/detalle-tipo?id=5501,"Mi argentina,AFIP"
5502,Rendición de Cuentas final - Convocatoria “POTENCIAR INDUSTRIA SATELITAL Y AEROESPACIAL”,Ministerio de Economía,2021-09-20,NO ARANCELADO,https://tramitesadistancia.gob.ar/tramitesadistancia/detalle-tipo?id=5502,"Mi argentina,AFIP"
5503,Certificación de Trayectos de Formación Profesional/Talleres de Oficio,Ministerio de Capital Humano,2021-09-21,NO ARANCELADO,https://tramitesadistancia.gob.ar/tramitesadistancia/detalle-tipo?id=5503,"Mi argentina,AFIP"
5504,Concurso Sumar Contenidos,Secretaría de Comunicación y Medios,2021-09-22,NO ARANCELADO,https://tramitesadistancia.gob.ar/tramitesadistancia/detalle-tipo?id=5504,"Mi argentina,AFIP"
5507,Sumarios Administrativos por Infracciones - Ley Nº 24.922,Ministerio de Economía,2021-09-29,NO ARANCELADO,https://tramitesadistancia.gob.ar/tramitesadistancia/detalle-tipo?id=5507,AFIP
5508,Programa de Financiamiento Naval,Ministerio de Economía,2021-09-29,NO ARANCELADO,https://tramitesadistancia.gob.ar/tramitesadistancia/detalle-tipo?id=5508,"Mi argentina,AFIP"
5509,Solicitud de Decretos Presidenciales Certificados entre 1947 y 2016,Jefatura de Gabinete de Ministros,2021-10-04,NO ARANCELADO,https://tramitesadistancia.gob.ar/tramitesadistancia/detalle-tipo?id=5509,"DNI,Mi argentina,ANSES,AFIP"
5513,Presentación de Oficios/Cédulas Judiciales - INTA,Ministerio de Economía,2021-10-06,NO ARANCELADO,https://tramitesadistancia.gob.ar/tramitesadistancia/detalle-tipo?id=5513,"DNI,Mi argentina,ANSES,AFIP"
5515,Soluciona Verde,Ministerio de Economía,2021-10-12,NO ARANCELADO,https://tramitesadistancia.gob.ar/tramitesadistancia/detalle-tipo?id=5515,"Mi argentina,AFIP"
5516,Presentación de Informes Técnicos Ferroviario,Ministerio de Economía,2021-10-12,NO ARANCELADO,https://tramitesadistancia.gob.ar/tramitesadistancia/detalle-tipo?id=5516,AFIP
5518,Solicitud de Dictamen Técnico para Proyectos Tecnológicos del Sector Público Nacional – ONTI,Jefatura de Gabinete de Ministros,2021-10-14,NO ARANCELADO,https://tramitesadistancia.gob.ar/tramitesadistancia/detalle-tipo?id=5518,"Mi argentina,AFIP"
5520,Inscripción al Registro de Entidades Previsionales,Ministerio de Capital Humano,2021-10-15,NO ARANCELADO,https://tramitesadistancia.gob.ar/tramitesadistancia/detalle-tipo?id=5520,"Mi argentina,AFIP"
5521,Certificado de años de servicio,Ministerio de Seguridad Nacional,2021-10-19,NO ARANCELADO,https://tramitesadistancia.gob.ar/tramitesadistancia/detalle-tipo?id=5521,"Mi argentina,AFIP"
5522,Solicitud de derecho a haber de pasividad,Ministerio de Seguridad Nacional,2021-10-19,NO ARANCELADO,https://tramitesadistancia.gob.ar/tramitesadistancia/detalle-tipo?id=5522,"Mi argentina,AFIP"
5523,Reconocimiento de Servicios,Ministerio de Seguridad Nacional,2021-10-19,NO ARANCELADO,https://tramitesadistancia.gob.ar/tramitesadistancia/detalle-tipo?id=5523,"Mi argentina,AFIP"
5524,Inscripción al Registro Público Único de Operadores de Fauna Silvestre,Jefatura de Gabinete de Ministros,2021-10-19,NO ARANCELADO,https://tramitesadistancia.gob.ar/tramitesadistancia/detalle-tipo?id=5524,"Mi argentina,AFIP"
5525,Modificación de Datos del Registro Público Único de Operadores de Fauna Silvestre,Jefatura de Gabinete de Ministros,2021-10-20,NO ARANCELADO,https://tramitesadistancia.gob.ar/tramitesadistancia/detalle-tipo?id=5525,"Mi argentina,AFIP"
5527,Presentación de Informes de Interventores y Administradores Provisorios,Ministerio de Salud,2021-10-25,NO ARANCELADO,https://tramitesadistancia.gob.ar/tramitesadistancia/detalle-tipo?id=5527,"Mi argentina,AFIP"
