id_tramite,nombre_tramite,organo_rector,fecha_publicacion_produccion,marca_arancelado,link_de_acceso,validador_identidad
1840,Habilitación al Registro Nacional de Centros de Tratamientos Cuarentenarios,Ministerio de Economía,2018-04-11,NO ARANCELADO,https://tramitesadistancia.gob.ar/tramitesadistancia/detalle-tipo?id=1840,"Mi argentina,AFIP"
1841,Modificación de datos del Registro de Bases de Datos Privadas,Jefatura de Gabinete de Ministros,2018-04-11,NO ARANCELADO,https://tramitesadistancia.gob.ar/tramitesadistancia/detalle-tipo?id=1841,"Mi argentina,AFIP"
1843,Declaración Jurada Cuotas ART.8.3.9,Ministerio de Economía,2018-04-11,NO ARANCELADO,https://tramitesadistancia.gob.ar/tramitesadistancia/detalle-tipo?id=1843,"Mi argentina,AFIP"
1847,Plan de Regularización de Déficit,Ministerio de Economía,2018-04-12,NO ARANCELADO,https://tramitesadistancia.gob.ar/tramitesadistancia/detalle-tipo?id=1847,"Mi argentina,AFIP"
1856,Declaración Jurada de Obras Editadas (Decreto N° 16.697/59),Ministerio de Justicia,2018-04-18,NO ARANCELADO,https://tramitesadistancia.gob.ar/tramitesadistancia/detalle-tipo?id=1856,"DNI,Mi argentina,ANSES,AFIP"
1858,Inscripción al Registro Nacional de Veterinarios y Técnicos Acreditados de la Dirección Nacional de Sanidad Animal,Ministerio de Economía,2018-04-18,NO ARANCELADO,https://tramitesadistancia.gob.ar/tramitesadistancia/detalle-tipo?id=1858,"Mi argentina,AFIP"
1859,Actualización de datos en el Registro Nacional de Veterinarios y Técnicos Acreditados de la Dirección Nacional de Sanidad Animal,Ministerio de Economía,2018-04-18,NO ARANCELADO,https://tramitesadistancia.gob.ar/tramitesadistancia/detalle-tipo?id=1859,"Mi argentina,AFIP"
1860,Fondo Aceleración – Beneficio Inversión Conjunta,Ministerio de Economía,2018-04-19,NO ARANCELADO,https://tramitesadistancia.gob.ar/tramitesadistancia/detalle-tipo?id=1860,"Mi argentina,AFIP"
1861,Fondo Aceleración – Beneficio Costos Operativos,Ministerio de Economía,2018-04-19,NO ARANCELADO,https://tramitesadistancia.gob.ar/tramitesadistancia/detalle-tipo?id=1861,"Mi argentina,AFIP"
1864,Inscripción de Bases de Datos Privadas,Jefatura de Gabinete de Ministros,2018-04-20,NO ARANCELADO,https://tramitesadistancia.gob.ar/tramitesadistancia/detalle-tipo?id=1864,"Mi argentina,AFIP"
1865,Inscripción al RENAVI,Ministerio de Economía,2018-04-20,NO ARANCELADO,https://tramitesadistancia.gob.ar/tramitesadistancia/detalle-tipo?id=1865,"Mi argentina,AFIP"
1866,Actualización de inscripción al RENAVI,Ministerio de Economía,2018-04-20,NO ARANCELADO,https://tramitesadistancia.gob.ar/tramitesadistancia/detalle-tipo?id=1866,"Mi argentina,AFIP"
1867,Simulá tu crédito COMEX,Ministerio de Economía,2018-04-23,NO ARANCELADO,https://tramitesadistancia.gob.ar/tramitesadistancia/detalle-tipo?id=1867,"Mi argentina,AFIP"
1868,Baja de matrícula,Ministerio de Salud,2018-04-23,NO ARANCELADO,https://tramitesadistancia.gob.ar/tramitesadistancia/detalle-tipo?id=1868,"Mi argentina,AFIP"
1870,Solicitud de Reintegro - Unidades Turísticas,Jefatura de Gabinete de Ministros,2018-04-24,NO ARANCELADO,https://tramitesadistancia.gob.ar/tramitesadistancia/detalle-tipo?id=1870,"DNI,Mi argentina,ANSES,AFIP"
1871,Permisos Turísticos/Habilitación Persona Jurídica,Jefatura de Gabinete de Ministros,2018-04-24,NO ARANCELADO,https://tramitesadistancia.gob.ar/tramitesadistancia/detalle-tipo?id=1871,"Mi argentina,AFIP"
1873,Permisos Turísticos/Habilitación Persona Humana,Jefatura de Gabinete de Ministros,2018-04-24,NO ARANCELADO,https://tramitesadistancia.gob.ar/tramitesadistancia/detalle-tipo?id=1873,"Mi argentina,AFIP"
1874,Vinculación/Desvinculación de Profesional con Firma,Ministerio de Economía,2018-04-24,NO ARANCELADO,https://tramitesadistancia.gob.ar/tramitesadistancia/detalle-tipo?id=1874,"Mi argentina,AFIP"
1875,Rúbrica de Libros - Mutuales,Ministerio de Capital Humano,2018-04-25,NO ARANCELADO,https://tramitesadistancia.gob.ar/tramitesadistancia/detalle-tipo?id=1875,"Mi argentina,AFIP"
1876,Permisos Turísticos/Baja de Actividad,Jefatura de Gabinete de Ministros,2018-04-25,NO ARANCELADO,https://tramitesadistancia.gob.ar/tramitesadistancia/detalle-tipo?id=1876,"Mi argentina,AFIP"
1879,Certificados de Operadores - Examen Libre en C.A.B.A,Jefatura de Gabinete de Ministros,2018-04-26,NO ARANCELADO,https://tramitesadistancia.gob.ar/tramitesadistancia/detalle-tipo?id=1879,"Mi argentina,AFIP"
1880,Inscripción de Proyectos Productivos o de Servicios en el Registro Nacional de Efectores,Ministerio de Capital Humano,2018-04-27,NO ARANCELADO,https://tramitesadistancia.gob.ar/tramitesadistancia/detalle-tipo?id=1880,"Mi argentina,AFIP"
1881,Solicitud de Certificado de Proyecto Productivo o de Servicio inscripto en el Registro Nacional de Efectores,Ministerio de Capital Humano,2018-04-27,NO ARANCELADO,https://tramitesadistancia.gob.ar/tramitesadistancia/detalle-tipo?id=1881,"Mi argentina,AFIP"
1882,Solicitud de Renovación Permiso Instalación Radioeléctrica (PIR) para estaciones COTCO,Ministerio de Economía,2018-04-27,NO ARANCELADO,https://tramitesadistancia.gob.ar/tramitesadistancia/detalle-tipo?id=1882,"Mi argentina,AFIP"
1883,Solicitud de Renovación Permiso Instalación Radioeléctrica (PIR) para estaciones radioeléctricas uso privado,Ministerio de Economía,2018-04-27,NO ARANCELADO,https://tramitesadistancia.gob.ar/tramitesadistancia/detalle-tipo?id=1883,"Mi argentina,AFIP"
1884,Baja de acceso al Servicio AUTENTICAR,Jefatura de Gabinete de Ministros,2018-05-02,NO ARANCELADO,https://tramitesadistancia.gob.ar/tramitesadistancia/detalle-tipo?id=1884,"Mi argentina,AFIP"
1885,Levantamiento Parcial de Inhibición de Inversiones,Ministerio de Economía,2018-05-02,NO ARANCELADO,https://tramitesadistancia.gob.ar/tramitesadistancia/detalle-tipo?id=1885,"Mi argentina,AFIP"
1887,Análisis de los impactos en la producción y comercialización que podrían derivarse de la autorización comercial de los ORGANISMOS VEGETALES GENÉTICAMENTE MODIFICADOS (OVGM) de uso agropecuario.,Ministerio de Economía,2018-05-07,NO ARANCELADO,https://tramitesadistancia.gob.ar/tramitesadistancia/detalle-tipo?id=1887,"Mi argentina,AFIP"
1888,Sistema de Supervisión del Reaseguro Automático,Ministerio de Economía,2018-05-08,NO ARANCELADO,https://tramitesadistancia.gob.ar/tramitesadistancia/detalle-tipo?id=1888,"Mi argentina,AFIP"
1889,Residuos Peligrosos - Ampliación Operaciones de Tratamiento,Jefatura de Gabinete de Ministros,2018-05-14,NO ARANCELADO,https://tramitesadistancia.gob.ar/tramitesadistancia/detalle-tipo?id=1889,"Mi argentina,AFIP"
1890,Cuota de Azúcar - Solicitud de Certificado,Ministerio de Economía,2018-05-14,NO ARANCELADO,https://tramitesadistancia.gob.ar/tramitesadistancia/detalle-tipo?id=1890,"Mi argentina,AFIP"
1891,Declaraciones Juradas de Warrants,Ministerio de Economía,2018-05-14,NO ARANCELADO,https://tramitesadistancia.gob.ar/tramitesadistancia/detalle-tipo?id=1891,"Mi argentina,AFIP"
1892,Residuos Peligrosos - Ampliación de Categorías Sometidas a Control,Jefatura de Gabinete de Ministros,2018-05-15,NO ARANCELADO,https://tramitesadistancia.gob.ar/tramitesadistancia/detalle-tipo?id=1892,"Mi argentina,AFIP"
1893,Presentación de cumplido de embarque – Exportación crudo de Azúcar,Ministerio de Economía,2018-05-15,NO ARANCELADO,https://tramitesadistancia.gob.ar/tramitesadistancia/detalle-tipo?id=1893,"Mi argentina,AFIP"
1894,Solicitud de Inscripción de Guías,Jefatura de Gabinete de Ministros,2018-05-16,NO ARANCELADO,https://tramitesadistancia.gob.ar/tramitesadistancia/detalle-tipo?id=1894,"Mi argentina,AFIP"
1895,Solicitud de Suspensión de Actividad de Guías,Jefatura de Gabinete de Ministros,2018-05-16,NO ARANCELADO,https://tramitesadistancia.gob.ar/tramitesadistancia/detalle-tipo?id=1895,"Mi argentina,AFIP"
1896,Solicitud de Baja de Actividad de Guías,Jefatura de Gabinete de Ministros,2018-05-16,NO ARANCELADO,https://tramitesadistancia.gob.ar/tramitesadistancia/detalle-tipo?id=1896,"Mi argentina,AFIP"
1897,Solicitud de Proyecto de Desarrollo Urbano,Jefatura de Gabinete de Ministros,2018-05-18,NO ARANCELADO,https://tramitesadistancia.gob.ar/tramitesadistancia/detalle-tipo?id=1897,"Mi argentina,AFIP"
1899,Baja de Bases de Datos Privadas,Jefatura de Gabinete de Ministros,2018-05-22,NO ARANCELADO,https://tramitesadistancia.gob.ar/tramitesadistancia/detalle-tipo?id=1899,"Mi argentina,AFIP"
1900,Baja de Responsable en el Registro Nacional de Bases de Datos,Jefatura de Gabinete de Ministros,2018-05-22,NO ARANCELADO,https://tramitesadistancia.gob.ar/tramitesadistancia/detalle-tipo?id=1900,"Mi argentina,AFIP"
1902,Rehabilitación al Registro Nacional de Centros de Tratamientos Cuarentenarios,Ministerio de Economía,2018-05-22,NO ARANCELADO,https://tramitesadistancia.gob.ar/tramitesadistancia/detalle-tipo?id=1902,"Mi argentina,AFIP"
1911,Presentación Concurso ANR Resolución ENACOM 2899/2018,Jefatura de Gabinete de Ministros,2018-05-23,NO ARANCELADO,https://tramitesadistancia.gob.ar/tramitesadistancia/detalle-tipo?id=1911,"Mi argentina,AFIP"
1913,Certificado de Libre Plática,Ministerio de Salud,2018-05-28,NO ARANCELADO,https://tramitesadistancia.gob.ar/tramitesadistancia/detalle-tipo?id=1913,"Mi argentina,AFIP"
1914,Registro de laboratorios de ensayo y diagnóstico de la Red Nacional de Laboratorios del SENASA - Modificación,Ministerio de Economía,2018-05-28,NO ARANCELADO,https://tramitesadistancia.gob.ar/tramitesadistancia/detalle-tipo?id=1914,"Mi argentina,AFIP"
1916,Habilitación de droguería para tránsito interjurisdiccional - Disp. 7038/15,Ministerio de Salud,2018-05-29,ARANCELADO,https://tramitesadistancia.gob.ar/tramitesadistancia/detalle-tipo?id=1916,"Mi argentina,AFIP"
1917,Renovación del certificado de buenas prácticas de distribución para droguerías,Ministerio de Salud,2018-05-29,ARANCELADO,https://tramitesadistancia.gob.ar/tramitesadistancia/detalle-tipo?id=1917,"Mi argentina,AFIP"
1919,Modificación de estructura de droguerías para tránsito interjurisdiccional,Ministerio de Salud,2018-05-29,ARANCELADO,https://tramitesadistancia.gob.ar/tramitesadistancia/detalle-tipo?id=1919,"Mi argentina,AFIP"
1920,Registro de Automotores Producidos Artesanalmente o en Bajas Series para uso particular,Ministerio de Economía,2018-05-29,NO ARANCELADO,https://tramitesadistancia.gob.ar/tramitesadistancia/detalle-tipo?id=1920,"Mi argentina,AFIP"
1921,Certificación de condiciones varias a requerimiento del productor,Ministerio de Economía,2018-05-29,NO ARANCELADO,https://tramitesadistancia.gob.ar/tramitesadistancia/detalle-tipo?id=1921,"Mi argentina,AFIP"
1922,Cierre por vacaciones - Droguerías para Tránsito Interjurisdiccional y Distribuidores de medicamentos y Operadores de medicamentos,Ministerio de Salud,2018-05-29,NO ARANCELADO,https://tramitesadistancia.gob.ar/tramitesadistancia/detalle-tipo?id=1922,"Mi argentina,AFIP"
1923,Habilitación para distribuidores de medicamentos y operadores logísticos de medicamentos,Ministerio de Salud,2018-05-29,ARANCELADO,https://tramitesadistancia.gob.ar/tramitesadistancia/detalle-tipo?id=1923,"Mi argentina,AFIP"
1924,Modificación de estructura/ampliación de rubro - Distribuidores de medicamentos y operadores logísticos de medicamentos,Ministerio de Salud,2018-05-30,NO ARANCELADO,https://tramitesadistancia.gob.ar/tramitesadistancia/detalle-tipo?id=1924,"Mi argentina,AFIP"
1925,Presentación de proyecto audiovisual,Secretaría de Cultura,2018-05-30,NO ARANCELADO,https://tramitesadistancia.gob.ar/tramitesadistancia/detalle-tipo?id=1925,"Mi argentina,AFIP"
1926,Solicitud de Evaluación de proyectos documentales con registro en soporte digital,Secretaría de Cultura,2018-05-30,NO ARANCELADO,https://tramitesadistancia.gob.ar/tramitesadistancia/detalle-tipo?id=1926,"Mi argentina,AFIP"
1927,Inscripción de Efector Social en el Registro Nacional de Efectores,Ministerio de Capital Humano,2018-06-01,NO ARANCELADO,https://tramitesadistancia.gob.ar/tramitesadistancia/detalle-tipo?id=1927,"Mi argentina,AFIP"
1928,Solicitud de Certificado de Efector Social inscripto en el Registro Nacional de Efectores,Ministerio de Capital Humano,2018-06-01,NO ARANCELADO,https://tramitesadistancia.gob.ar/tramitesadistancia/detalle-tipo?id=1928,"Mi argentina,AFIP"
1929,Inscripción de Cooperativas Agropecuarias o de Provisión en el Registro Nacional de Efectores,Ministerio de Capital Humano,2018-06-01,NO ARANCELADO,https://tramitesadistancia.gob.ar/tramitesadistancia/detalle-tipo?id=1929,"Mi argentina,AFIP"
1930,Solicitud de Certificado de Cooperativa Agropecuaria o de Provisión inscripta en el Registro Nacional de Efectores,Ministerio de Capital Humano,2018-06-01,NO ARANCELADO,https://tramitesadistancia.gob.ar/tramitesadistancia/detalle-tipo?id=1930,"Mi argentina,AFIP"
1931,Baja de Proyectos Productivos o de Servicios inscriptos en el Registro Nacional de Efectores,Ministerio de Capital Humano,2018-06-01,NO ARANCELADO,https://tramitesadistancia.gob.ar/tramitesadistancia/detalle-tipo?id=1931,"Mi argentina,AFIP"
1932,Renuncia de Cooperativa de Trabajo Efectora,Ministerio de Capital Humano,2018-06-01,NO ARANCELADO,https://tramitesadistancia.gob.ar/tramitesadistancia/detalle-tipo?id=1932,"Mi argentina,AFIP"
1933,Inscripción al Registro de Productos Veterinarios,Ministerio de Economía,2018-06-01,NO ARANCELADO,https://tramitesadistancia.gob.ar/tramitesadistancia/detalle-tipo?id=1933,"Mi argentina,AFIP"
1934,Recategorización de la Licencia de MMA | Habilitación de la Licencia de MERA,Ministerio de Economía,2018-06-01,NO ARANCELADO,https://tramitesadistancia.gob.ar/tramitesadistancia/detalle-tipo?id=1934,"Mi argentina,AFIP"
1935,Desafectación de Instructores CIAC /CEAC | RAAC 141 – 142 – 147,Ministerio de Economía,2018-06-01,NO ARANCELADO,https://tramitesadistancia.gob.ar/tramitesadistancia/detalle-tipo?id=1935,"Mi argentina,AFIP"
1936,Modificación/Baja de las condiciones de aprobación en el registro de productos veterinarios,Ministerio de Economía,2018-06-01,NO ARANCELADO,https://tramitesadistancia.gob.ar/tramitesadistancia/detalle-tipo?id=1936,"Mi argentina,AFIP"
1937,Solicitud de Inscripción en el Registro Nacional de Establecimientos Fitosanitarios,Ministerio de Economía,2018-06-05,NO ARANCELADO,https://tramitesadistancia.gob.ar/tramitesadistancia/detalle-tipo?id=1937,"Mi argentina,AFIP"
1938,Postulación a Auditor Interno,Sindicatura General De La Nación,2018-06-06,NO ARANCELADO,https://tramitesadistancia.gob.ar/tramitesadistancia/detalle-tipo?id=1938,"Mi argentina,AFIP"
1939,Afectación de Aeronaves | CIAC 141 Tipo 2 y Tipo 3,Ministerio de Economía,2018-06-06,NO ARANCELADO,https://tramitesadistancia.gob.ar/tramitesadistancia/detalle-tipo?id=1939,"Mi argentina,AFIP"
1940,Desafectación de Aeronaves | CIAC 141 Tipo 2 y Tipo 3,Ministerio de Economía,2018-06-06,NO ARANCELADO,https://tramitesadistancia.gob.ar/tramitesadistancia/detalle-tipo?id=1940,"Mi argentina,AFIP"
1941,Suspensión de la Matrícula por Cargo,Ministerio de Economía,2018-06-06,NO ARANCELADO,https://tramitesadistancia.gob.ar/tramitesadistancia/detalle-tipo?id=1941,"Mi argentina,AFIP"
1948,Solicitud de planes de pago,Jefatura de Gabinete de Ministros,2018-06-07,NO ARANCELADO,https://tramitesadistancia.gob.ar/tramitesadistancia/detalle-tipo?id=1948,"Mi argentina,AFIP"
1950,Maquinaria Agrícola – Solicitud de informe técnico,Ministerio de Economía,2018-06-11,NO ARANCELADO,https://tramitesadistancia.gob.ar/tramitesadistancia/detalle-tipo?id=1950,"Mi argentina,AFIP"
1951,Derechos de Importación Extrazona - Fijación- Solicitud de informe técnico,Ministerio de Economía,2018-06-11,NO ARANCELADO,https://tramitesadistancia.gob.ar/tramitesadistancia/detalle-tipo?id=1951,"Mi argentina,AFIP"
1952,Solicitud de Prórroga de Importación o Exportación de Explosivos y Nitrato de Amonio,Ministerio de Seguridad Nacional,2018-06-11,NO ARANCELADO,https://tramitesadistancia.gob.ar/tramitesadistancia/detalle-tipo?id=1952,"Mi argentina,AFIP"
1954,Inscripción a la Red Nacional de Laboratorios (RedLab) SENASA,Ministerio de Economía,2018-06-11,NO ARANCELADO,https://tramitesadistancia.gob.ar/tramitesadistancia/detalle-tipo?id=1954,"Mi argentina,AFIP"
1958,Resignación de Cuota Leche,Ministerio de Economía,2018-06-11,NO ARANCELADO,https://tramitesadistancia.gob.ar/tramitesadistancia/detalle-tipo?id=1958,"Mi argentina,AFIP"
1959,Autorización individual para el uso de equipos de Rx,Ministerio de Salud,2018-06-12,NO ARANCELADO,https://tramitesadistancia.gob.ar/tramitesadistancia/detalle-tipo?id=1959,"Mi argentina,AFIP"
1960,Solicitud de Clave Única de Reordenamiento Territorial (CURT),Ministerio de Economía,2018-06-12,NO ARANCELADO,https://tramitesadistancia.gob.ar/tramitesadistancia/detalle-tipo?id=1960,"Mi argentina,AFIP"
1961,Autorización individual para el uso de equipos láser e IPL,Ministerio de Salud,2018-06-12,NO ARANCELADO,https://tramitesadistancia.gob.ar/tramitesadistancia/detalle-tipo?id=1961,"Mi argentina,AFIP"
1962,Certificado de Ética Profesional,Ministerio de Salud,2018-06-12,NO ARANCELADO,https://tramitesadistancia.gob.ar/tramitesadistancia/detalle-tipo?id=1962,"Mi argentina,AFIP"
1964,Inscripción al Registro Nacional de Puertos,Ministerio de Economía,2018-06-13,NO ARANCELADO,https://tramitesadistancia.gob.ar/tramitesadistancia/detalle-tipo?id=1964,AFIP
1966,Baja de la Matricula,Ministerio de Economía,2018-06-14,NO ARANCELADO,https://tramitesadistancia.gob.ar/tramitesadistancia/detalle-tipo?id=1966,"Mi argentina,AFIP"
1967,Suspensión Temporaria de la Matrícula,Ministerio de Economía,2018-06-14,NO ARANCELADO,https://tramitesadistancia.gob.ar/tramitesadistancia/detalle-tipo?id=1967,"Mi argentina,AFIP"
1968,Origen de Mercaderías - Habilitación nuevas entidades certificadoras,Ministerio de Economía,2018-06-14,NO ARANCELADO,https://tramitesadistancia.gob.ar/tramitesadistancia/detalle-tipo?id=1968,"Mi argentina,AFIP"
1969,Origen de Mercaderías - Consultas entidades certificadoras,Ministerio de Economía,2018-06-14,NO ARANCELADO,https://tramitesadistancia.gob.ar/tramitesadistancia/detalle-tipo?id=1969,"Mi argentina,AFIP"
1970,Origen de Mercaderías - Cuestionario de Verificación,Ministerio de Economía,2018-06-14,NO ARANCELADO,https://tramitesadistancia.gob.ar/tramitesadistancia/detalle-tipo?id=1970,"Mi argentina,AFIP"
1971,Origen de Mercaderías - Firmas de entidades certificadoras,Ministerio de Economía,2018-06-14,NO ARANCELADO,https://tramitesadistancia.gob.ar/tramitesadistancia/detalle-tipo?id=1971,"Mi argentina,AFIP"
1974,Contratación de Residentes y Jefes/as de las Residencias del Equipo de Salud,Ministerio de Salud,2018-06-15,NO ARANCELADO,https://tramitesadistancia.gob.ar/tramitesadistancia/detalle-tipo?id=1974,"Mi argentina,AFIP"
1975,Solicitud de inscripción del Contrato de Prenda Digital (firma en TAD),Ministerio de Justicia,2018-06-18,NO ARANCELADO,https://tramitesadistancia.gob.ar/tramitesadistancia/detalle-tipo?id=1975,"Mi argentina,AFIP"
1976,Solicitud de Certificado de Importación de Automotores para Eventualistas,Ministerio de Justicia,2018-06-18,NO ARANCELADO,https://tramitesadistancia.gob.ar/tramitesadistancia/detalle-tipo?id=1976,"Mi argentina,AFIP"
1977,Pedido de Rectificación de Certificado de Importación de Automotores,Ministerio de Justicia,2018-06-18,NO ARANCELADO,https://tramitesadistancia.gob.ar/tramitesadistancia/detalle-tipo?id=1977,"Mi argentina,AFIP"
1978,Solicitud de alta de código MTM,Ministerio de Justicia,2018-06-18,NO ARANCELADO,https://tramitesadistancia.gob.ar/tramitesadistancia/detalle-tipo?id=1978,"Mi argentina,AFIP"
1979,Infracciones Ambientales - Solicitud de Beneficio de Pago Voluntario,Jefatura de Gabinete de Ministros,2018-06-19,NO ARANCELADO,https://tramitesadistancia.gob.ar/tramitesadistancia/detalle-tipo?id=1979,"Mi argentina,AFIP"
1980,Infracciones Ambientales - Descargo y/o Respuesta ante Requerimientos de la Dirección de Protección Ambiental,Jefatura de Gabinete de Ministros,2018-06-19,NO ARANCELADO,https://tramitesadistancia.gob.ar/tramitesadistancia/detalle-tipo?id=1980,"Mi argentina,AFIP"
1981,Baja de postulación en el Registro de Postulantes a Titulares de Auditoría Interna,Sindicatura General De La Nación,2018-06-22,NO ARANCELADO,https://tramitesadistancia.gob.ar/tramitesadistancia/detalle-tipo?id=1981,"Mi argentina,AFIP"
1982,Actualización de datos en el Registro de Postulantes a Titulares de Auditoría Interna,Sindicatura General De La Nación,2018-06-22,NO ARANCELADO,https://tramitesadistancia.gob.ar/tramitesadistancia/detalle-tipo?id=1982,"Mi argentina,AFIP"
1983,Solicitud de certificado de horas de vuelo para Pilotos o Tripulantes de Cabina de Pasajeros por robo u extravío,Ministerio de Economía,2018-06-22,NO ARANCELADO,https://tramitesadistancia.gob.ar/tramitesadistancia/detalle-tipo?id=1983,"Mi argentina,AFIP"
1984,Registro de Organizaciones de la Sociedad Civil,Ministerio de Justicia,2018-06-22,NO ARANCELADO,https://tramitesadistancia.gob.ar/tramitesadistancia/detalle-tipo?id=1984,"Mi argentina,AFIP"
1985,Solicitud de certificado de horas de vuelo para Pilotos o Tripulantes de Cabina de Pasajeros,Ministerio de Economía,2018-06-22,NO ARANCELADO,https://tramitesadistancia.gob.ar/tramitesadistancia/detalle-tipo?id=1985,"Mi argentina,AFIP"
2001,Modificación al Registro de firmas de productos veterinarios - Cambio de Razón Social y otros cambios legales,Ministerio de Economía,2018-06-28,NO ARANCELADO,https://tramitesadistancia.gob.ar/tramitesadistancia/detalle-tipo?id=2001,"Mi argentina,AFIP"
2003,Solicitud de inscripción del Contrato de Prenda Digital (firma externa),Ministerio de Justicia,2018-06-28,NO ARANCELADO,https://tramitesadistancia.gob.ar/tramitesadistancia/detalle-tipo?id=2003,"Mi argentina,AFIP"
2004,Exportación para reparación – Solicitud de informe técnico,Ministerio de Economía,2018-06-29,NO ARANCELADO,https://tramitesadistancia.gob.ar/tramitesadistancia/detalle-tipo?id=2004,"Mi argentina,AFIP"
2005,Ley de Minería – Solicitud de informe técnico,Ministerio de Economía,2018-06-29,NO ARANCELADO,https://tramitesadistancia.gob.ar/tramitesadistancia/detalle-tipo?id=2005,"Mi argentina,AFIP"
2009,Ampliación de rubro - Distribuidores y Operadores Logísticos de medicamentos y/o Droguerías,Ministerio de Salud,2018-06-29,ARANCELADO,https://tramitesadistancia.gob.ar/tramitesadistancia/detalle-tipo?id=2009,"Mi argentina,AFIP"
2010,Inscripción al Registro Nacional de Firmas de alimentación animal,Ministerio de Economía,2018-07-02,NO ARANCELADO,https://tramitesadistancia.gob.ar/tramitesadistancia/detalle-tipo?id=2010,"Mi argentina,AFIP"
2011,Modificación al Registro Nacional de Firmas de alimentación animal,Ministerio de Economía,2018-07-02,NO ARANCELADO,https://tramitesadistancia.gob.ar/tramitesadistancia/detalle-tipo?id=2011,"Mi argentina,AFIP"
2012,Autorización de Exportación de Fitosanitarios y Fertilizantes - Prioritarios hasta 3 dias,Ministerio de Economía,2018-07-02,NO ARANCELADO,https://tramitesadistancia.gob.ar/tramitesadistancia/detalle-tipo?id=2012,"Mi argentina,AFIP"
2017,Actualización de datos del Monotributo Social Agropecuario,Ministerio de Economía,2018-07-04,NO ARANCELADO,https://tramitesadistancia.gob.ar/tramitesadistancia/detalle-tipo?id=2017,"Mi argentina,AFIP"
2019,Respuesta a requerimientos de la Coordinación de Atención al Asegurado de la SSN,Ministerio de Economía,2018-07-04,NO ARANCELADO,https://tramitesadistancia.gob.ar/tramitesadistancia/detalle-tipo?id=2019,"Mi argentina,AFIP"
2020,Presentación de Informes Contables al Plan Incluir Salud – Auditoria Contable,Ministerio de Salud,2018-07-04,NO ARANCELADO,https://tramitesadistancia.gob.ar/tramitesadistancia/detalle-tipo?id=2020,"Mi argentina,AFIP"
2021,Solicitud de servidumbre,Jefatura de Gabinete de Ministros,2018-07-05,NO ARANCELADO,https://tramitesadistancia.gob.ar/tramitesadistancia/detalle-tipo?id=2021,"Mi argentina,AFIP"
2022,Solicitud de apertura de calle (Permiso de uso con compromiso de compra),Jefatura de Gabinete de Ministros,2018-07-05,NO ARANCELADO,https://tramitesadistancia.gob.ar/tramitesadistancia/detalle-tipo?id=2022,"Mi argentina,AFIP"
2026,Reinscripción al registro de productos destinados a la alimentación animal,Ministerio de Economía,2018-07-05,NO ARANCELADO,https://tramitesadistancia.gob.ar/tramitesadistancia/detalle-tipo?id=2026,"Mi argentina,AFIP"
2028,Modificación en el Registro de Productos destinados a la alimentación animal,Ministerio de Economía,2018-07-05,NO ARANCELADO,https://tramitesadistancia.gob.ar/tramitesadistancia/detalle-tipo?id=2028,"Mi argentina,AFIP"
2030,Solicitud de Modificación de Datos en el Registro Nacional de Establecimientos Fitosanitarios,Ministerio de Economía,2018-07-05,NO ARANCELADO,https://tramitesadistancia.gob.ar/tramitesadistancia/detalle-tipo?id=2030,"Mi argentina,AFIP"
2031,Actualización de datos Registro Nacional de Conciliadores Laborales,Ministerio de Justicia,2018-07-05,NO ARANCELADO,https://tramitesadistancia.gob.ar/tramitesadistancia/detalle-tipo?id=2031,"Mi argentina,AFIP"
2032,Solicitud de Licencias de Conciliadores Laborales,Ministerio de Justicia,2018-07-05,NO ARANCELADO,https://tramitesadistancia.gob.ar/tramitesadistancia/detalle-tipo?id=2032,"Mi argentina,AFIP"
2033,Solicitud de Renuncia al Registro Nacional de Conciliadores Laborales,Ministerio de Justicia,2018-07-05,NO ARANCELADO,https://tramitesadistancia.gob.ar/tramitesadistancia/detalle-tipo?id=2033,"Mi argentina,AFIP"
2034,Presentación de pago de Matrícula de Conciliadores Laborales,Ministerio de Justicia,2018-07-05,NO ARANCELADO,https://tramitesadistancia.gob.ar/tramitesadistancia/detalle-tipo?id=2034,"Mi argentina,AFIP"
2035,Solicitud de Emisión de Certificación Art. 13 Ley 24635 - Conciliadores Laborales,Ministerio de Justicia,2018-07-05,NO ARANCELADO,https://tramitesadistancia.gob.ar/tramitesadistancia/detalle-tipo?id=2035,"Mi argentina,AFIP"
